{
  "id": "tenchi2",
  "name": {
    "zh": "吞食天地II 诸葛孔明传",
    "en": "Tenchi wo Kurau II",
    "ja": "天地を喰らうII"
  },
  "defaultMap": "world_map",
  "maps": {
    "world_map": {
      "name": {
        "zh": "世界地图",
        "en": "World Map",
        "ja": "ワールドマップ"
      },
      "type": "image",
      "image": "world_map/world_map_full.png",
      "tileSize": 16,
      "triggers": [
        {
          "id": "wm_t00",
          "bounds": [
            [
              4624,
              1888
            ],
            [
              4640,
              1904
            ]
          ],
          "target": "scene_02_x00y00",
          "label": {
            "zh": "→ 场景 02",
            "en": "→ 场景 02"
          }
        },
        {
          "id": "wm_t01",
          "bounds": [
            [
              5024,
              1328
            ],
            [
              5040,
              1344
            ]
          ],
          "target": "scene_0A_x01y31",
          "label": {
            "zh": "→ 场景 0A",
            "en": "→ 场景 0A"
          }
        },
        {
          "id": "wm_t02",
          "bounds": [
            [
              5056,
              1424
            ],
            [
              5072,
              1440
            ]
          ],
          "target": "scene_03_x02y11",
          "label": {
            "zh": "→ 场景 03",
            "en": "→ 场景 03"
          }
        },
        {
          "id": "wm_t03",
          "bounds": [
            [
              4256,
              880
            ],
            [
              4272,
              896
            ]
          ],
          "target": "scene_0A_x01y21",
          "label": {
            "zh": "→ 场景 0A",
            "en": "→ 场景 0A"
          }
        },
        {
          "id": "wm_t04",
          "bounds": [
            [
              4224,
              768
            ],
            [
              4240,
              784
            ]
          ],
          "target": "scene_0A_x01y21",
          "label": {
            "zh": "→ 场景 0A",
            "en": "→ 场景 0A"
          }
        },
        {
          "id": "wm_t05",
          "bounds": [
            [
              4608,
              464
            ],
            [
              4624,
              480
            ]
          ],
          "target": "scene_09_x0Dy31",
          "label": {
            "zh": "→ 场景 09",
            "en": "→ 场景 09"
          }
        },
        {
          "id": "wm_t06",
          "bounds": [
            [
              5136,
              560
            ],
            [
              5152,
              576
            ]
          ],
          "target": "scene_18_x0Dy01",
          "label": {
            "zh": "→ 场景 18",
            "en": "→ 场景 18"
          }
        },
        {
          "id": "wm_t07",
          "bounds": [
            [
              4592,
              320
            ],
            [
              4608,
              336
            ]
          ],
          "target": "scene_10_x05y01",
          "label": {
            "zh": "→ 场景 10",
            "en": "→ 场景 10"
          }
        },
        {
          "id": "wm_t08",
          "bounds": [
            [
              3536,
              1376
            ],
            [
              3552,
              1392
            ]
          ],
          "target": "scene_17_x09y01",
          "label": {
            "zh": "→ 场景 17",
            "en": "→ 场景 17"
          }
        },
        {
          "id": "wm_t09",
          "bounds": [
            [
              3616,
              1376
            ],
            [
              3632,
              1392
            ]
          ],
          "target": "scene_0B_x05y31",
          "label": {
            "zh": "→ 场景 0B",
            "en": "→ 场景 0B"
          }
        },
        {
          "id": "wm_t10",
          "bounds": [
            [
              3872,
              1968
            ],
            [
              3888,
              1984
            ]
          ],
          "target": "scene_0B_x05y25",
          "label": {
            "zh": "→ 场景 0B",
            "en": "→ 场景 0B"
          }
        },
        {
          "id": "wm_t11",
          "bounds": [
            [
              3952,
              1728
            ],
            [
              3968,
              1744
            ]
          ],
          "target": "scene_1B_x0By25",
          "label": {
            "zh": "→ 场景 1B",
            "en": "→ 场景 1B"
          }
        },
        {
          "id": "wm_t12",
          "bounds": [
            [
              3280,
              2544
            ],
            [
              3296,
              2560
            ]
          ],
          "target": "scene_1C_x10y01",
          "label": {
            "zh": "→ 场景 1C",
            "en": "→ 场景 1C"
          }
        },
        {
          "id": "wm_t13",
          "bounds": [
            [
              3216,
              2240
            ],
            [
              3232,
              2256
            ]
          ],
          "target": "scene_1D_x15y00",
          "label": {
            "zh": "→ 场景 1D",
            "en": "→ 场景 1D"
          }
        },
        {
          "id": "wm_t14",
          "bounds": [
            [
              3520,
              2672
            ],
            [
              3536,
              2688
            ]
          ],
          "target": "scene_23_x12y25",
          "label": {
            "zh": "→ 场景 23",
            "en": "→ 场景 23"
          }
        },
        {
          "id": "wm_t15",
          "bounds": [
            [
              3776,
              2768
            ],
            [
              3792,
              2784
            ]
          ],
          "target": "scene_24_x1Dy24",
          "label": {
            "zh": "→ 场景 24",
            "en": "→ 场景 24"
          }
        },
        {
          "id": "wm_t16",
          "bounds": [
            [
              3104,
              2560
            ],
            [
              3120,
              2576
            ]
          ],
          "target": "scene_09_x11y31",
          "label": {
            "zh": "→ 场景 09",
            "en": "→ 场景 09"
          }
        },
        {
          "id": "wm_t17",
          "bounds": [
            [
              416,
              5200
            ],
            [
              432,
              5216
            ]
          ],
          "target": "scene_28_x00y37",
          "label": {
            "zh": "→ 场景 28",
            "en": "→ 场景 28"
          }
        },
        {
          "id": "wm_t18",
          "bounds": [
            [
              3872,
              3664
            ],
            [
              3888,
              3680
            ]
          ],
          "target": "scene_15_x09y31",
          "label": {
            "zh": "→ 场景 15",
            "en": "→ 场景 15"
          }
        },
        {
          "id": "wm_t19",
          "bounds": [
            [
              5472,
              2976
            ],
            [
              5488,
              2992
            ]
          ],
          "target": "scene_2A_x13y10",
          "label": {
            "zh": "→ 场景 2A",
            "en": "→ 场景 2A"
          }
        },
        {
          "id": "wm_t20",
          "bounds": [
            [
              2736,
              2688
            ],
            [
              2752,
              2704
            ]
          ],
          "target": "scene_39_x05y05",
          "label": {
            "zh": "→ 场景 39",
            "en": "→ 场景 39"
          }
        },
        {
          "id": "wm_t21",
          "bounds": [
            [
              4800,
              4352
            ],
            [
              4816,
              4368
            ]
          ],
          "target": "scene_0B_x1Ay31",
          "label": {
            "zh": "→ 场景 0B",
            "en": "→ 场景 0B"
          }
        },
        {
          "id": "wm_t22",
          "bounds": [
            [
              5248,
              3552
            ],
            [
              5264,
              3568
            ]
          ],
          "target": "scene_26_x15y31",
          "label": {
            "zh": "→ 场景 26",
            "en": "→ 场景 26"
          }
        },
        {
          "id": "wm_t23",
          "bounds": [
            [
              2432,
              4496
            ],
            [
              2448,
              4512
            ]
          ],
          "target": "scene_3E_x0Fy6A",
          "label": {
            "zh": "→ 场景 3E",
            "en": "→ 场景 3E"
          }
        },
        {
          "id": "wm_t24",
          "bounds": [
            [
              4464,
              3648
            ],
            [
              4480,
              3664
            ]
          ],
          "target": "scene_37_x01y05",
          "label": {
            "zh": "→ 场景 37",
            "en": "→ 场景 37"
          }
        },
        {
          "id": "wm_t25",
          "bounds": [
            [
              3440,
              3232
            ],
            [
              3456,
              3248
            ]
          ],
          "target": "scene_38_x06y05",
          "label": {
            "zh": "→ 场景 38",
            "en": "→ 场景 38"
          }
        },
        {
          "id": "wm_t26",
          "bounds": [
            [
              3216,
              2240
            ],
            [
              3232,
              2256
            ]
          ],
          "target": "scene_3B_x15y04",
          "label": {
            "zh": "→ 场景 3B",
            "en": "→ 场景 3B"
          }
        },
        {
          "id": "wm_t27",
          "bounds": [
            [
              2512,
              4192
            ],
            [
              2528,
              4208
            ]
          ],
          "target": "scene_41_x0Ey05",
          "label": {